{
  "$schema": "http://json-schema.org/draft-07/schema#",
  "$id": "http://trebent.com/kerberos/schemas/config_schema.json",
  "type": "object",
  "description": "Kerberos API gateway configuration.",
  "properties": {
    "gateway": {
      "$ref": "http://trebent.com/kerberos/schemas/gateway_schema.json"
    },
    "oas": {
      "$ref": "http://trebent.com/kerberos/schemas/oas_schema.json"
    },
    "auth": {
      "$ref": "http://trebent.com/kerberos/schemas/auth_schema.json"
    },
    "admin": {
      "$ref": "http://trebent.com/kerberos/schemas/admin_schema.json"
    },
    "observability": {
      "$ref": "http://trebent.com/kerberos/schemas/observability_schema.json"
    },
    "persistence": {
      "$ref": "http://trebent.com/kerberos/schemas/persistence_schema.json"
    }
  },
  "additionalProperties": false,
  "required": [
    "gateway"
  ]
}